{
  "authority": {
    "automatic_commit": false,
    "automatic_fix": false,
    "automatic_merge": false,
    "automatic_pull_request": false,
    "automatic_push": false,
    "human_review_required": true,
    "patch_authority": "exact_source_spans_and_hashes_only",
    "production_mutation": false,
    "vsa_patch_authority": false
  },
  "created_at": "2026-07-19",
  "lessons": [
    {
      "confidence": 0.99,
      "defect_class": "authority_alias_bypass",
      "detector_id": "detect_authority_aliases",
      "false_positive_guard": "Only keys whose separator-insensitive normalized form equals a protected authority key are findings.",
      "generalization_scope": [
        "metadata",
        "schemas",
        "interaction packets",
        "scene packets",
        "review adapters"
      ],
      "invariant": "Metadata must never contradict or alias the authority contract.",
      "lesson_id": "PR164-CW-AUTH-001",
      "provenance": {
        "paths": [
          "aura_spatial_interaction.py",
          "aura_spatial_scene.py",
          "schemas/aura_spatial_scene.schema.json"
        ],
        "pr_number": 164,
        "reviewers": [
          "Codex",
          "manual"
        ]
      },
      "repair_pattern": "Normalize security-sensitive keys by case-folding and removing separators, then reject canonical and aliased authority keys recursively.",
      "required_regression": "Exercise camelCase, mixedCase, snake_case, hyphenated, spaced, and fully separator-split aliases at every metadata depth.",
      "trigger": "Untrusted metadata uses camel, mixed, hyphenated, spaced, or separator-split aliases of protected authority fields."
    },
    {
      "confidence": 0.99,
      "defect_class": "protected_authority_override",
      "detector_id": "detect_protected_metadata_overrides",
      "false_positive_guard": "Canonical protected keys with the exact false value remain permitted only where the contract explicitly serializes them.",
      "generalization_scope": [
        "metadata merging",
        "renderer hints",
        "interaction evidence",
        "review receipts"
      ],
      "invariant": "Protected non-authority fields remain exactly false after merging untrusted metadata.",
      "lesson_id": "PR164-CW-AUTH-002",
      "provenance": {
        "paths": [
          "aura_spatial_interaction.py"
        ],
        "pr_number": 164,
        "reviewers": [
          "Codex"
        ]
      },
      "repair_pattern": "Reject protected keys before merge and reassert the immutable false authority envelope after sanitization.",
      "required_regression": "Attempt true, truthy, null, nested, and conflicting values for every protected field.",
      "trigger": "Caller metadata overwrites a protected false authority field or supplies a contradictory canonical value."
    },
    {
      "confidence": 0.99,
      "defect_class": "count_bounded_byte_unbounded",
      "detector_id": "detect_count_without_byte_budget",
      "false_positive_guard": "Computed internal values with a provable fixed-size representation are not treated as attacker-controlled variable evidence.",
      "generalization_scope": [
        "metadata",
        "source refs",
        "WebSocket packets",
        "review comments",
        "scene records"
      ],
      "invariant": "Every attacker-controlled retained evidence path needs count and byte bounds.",
      "lesson_id": "PR164-CW-BND-001",
      "provenance": {
        "paths": [
          "aura_spatial_contracts.py",
          "aura_spatial_interaction.py"
        ],
        "pr_number": 164,
        "reviewers": [
          "Codex",
          "manual"
        ]
      },
      "repair_pattern": "Apply per-item, aggregate, and canonical serialized-byte ceilings before retention or handoff.",
      "required_regression": "Use few extremely large items as well as many small items and assert fail-closed behavior.",
      "trigger": "Attacker-controlled retained evidence has an item count cap but no per-item and aggregate byte caps."
    },
    {
      "confidence": 1.0,
      "defect_class": "noncanonical_interchange_accepted",
      "detector_id": "detect_noncanonical_interchange_acceptance",
      "false_positive_guard": "Order-significant arrays remain valid when their contract explicitly defines order and digest semantics.",
      "generalization_scope": [
        "scene interchange",
        "review lesson registries",
        "cache keys",
        "receipts"
      ],
      "invariant": "Canonical representation equality is checked before accepting an external digest.",
      "lesson_id": "PR164-CW-CANON-001",
      "provenance": {
        "paths": [
          "aura_spatial_scene.py"
        ],
        "pr_number": 164,
        "reviewers": [
          "Codex",
          "manual"
        ]
      },
      "repair_pattern": "Validate structure, ordering, uniqueness, runtime semantics, canonical reconstruction, field equality, then canonical digest.",
      "required_regression": "Reorder and duplicate records/source refs, recompute a digest, and assert rejection.",
      "trigger": "Externally supplied records or set-like fields are unsorted/duplicated yet accepted with a self-consistent digest."
    },
    {
      "confidence": 0.98,
      "defect_class": "order_dependent_identity",
      "detector_id": "detect_order_dependent_digesting",
      "false_positive_guard": "Do not flag order-significant sequences whose contract explicitly preserves order.",
      "generalization_scope": [
        "topology links",
        "scene records",
        "source refs",
        "review findings"
      ],
      "invariant": "Canonicalize before ID assignment, digesting, caching, or interchange.",
      "lesson_id": "PR164-CW-DET-001",
      "provenance": {
        "paths": [
          "aura_spatial_projection.py"
        ],
        "pr_number": 164,
        "reviewers": [
          "Codex"
        ]
      },
      "repair_pattern": "Build a stable semantic sort key, deduplicate, then assign identities and compute digests.",
      "required_regression": "Permute equivalent records repeatedly and assert byte-identical canonical output and stable IDs.",
      "trigger": "Set-like records reach ID assignment, digesting, caching, or interchange in caller-provided order."
    },
    {
      "confidence": 0.98,
      "defect_class": "truncate_before_canonicalize",
      "detector_id": "detect_truncate_before_sort",
      "false_positive_guard": "Streaming or priority queues are exempt only when priority ordering is explicit, deterministic, and tested.",
      "generalization_scope": [
        "topology",
        "evidence selection",
        "review consolidation",
        "search results"
      ],
      "invariant": "Sort and deduplicate before truncation.",
      "lesson_id": "PR164-CW-DET-002",
      "provenance": {
        "paths": [
          "aura_spatial_projection.py"
        ],
        "pr_number": 164,
        "reviewers": [
          "Codex"
        ]
      },
      "repair_pattern": "Normalize the full bounded candidate set, sort by a stable key, deduplicate, then truncate.",
      "required_regression": "Permute over-cap inputs and assert the same retained subset.",
      "trigger": "A cap is applied to a set-like collection before stable sorting."
    },
    {
      "confidence": 1.0,
      "defect_class": "stale_evidence_claim",
      "detector_id": "detect_stale_evidence_claim",
      "false_positive_guard": "Historical evidence may be retained when it is explicitly labeled historical and bound to its SHA.",
      "generalization_scope": [
        "PR descriptions",
        "handoffs",
        "CI receipts",
        "review learning"
      ],
      "invariant": "Every verification claim binds to an exact commit, run, and observed status.",
      "lesson_id": "PR164-CW-EVID-001",
      "provenance": {
        "paths": [
          "AURAOS_NEXT_AI_CODING_RUN_HANDOFF_PR164_POST_MERGE.md"
        ],
        "pr_number": 164,
        "reviewers": [
          "manual"
        ]
      },
      "repair_pattern": "Preserve exact evidence status vocabulary and repository-head binding in receipts and summaries.",
      "required_regression": "Reject configured\u2192passed, historical\u2192current, file-exists\u2192executed, and manual\u2192CI claim upgrades.",
      "trigger": "Configured, historical, queued, or unexecuted evidence is described as a current-head pass."
    },
    {
      "confidence": 0.99,
      "defect_class": "implicit_coordinate_basis_change",
      "detector_id": "detect_implicit_coordinate_basis_change",
      "false_positive_guard": "Identical frame conventions and explicitly converted changes are permitted.",
      "generalization_scope": [
        "spatial frames",
        "asset importers",
        "OpenXR/WebXR adapters"
      ],
      "invariant": "Basis changes must be explicit and tested.",
      "lesson_id": "PR164-CW-FRM-001",
      "provenance": {
        "paths": [
          "aura_spatial_coordinate_frames.py"
        ],
        "pr_number": 164,
        "reviewers": [
          "Codex"
        ]
      },
      "repair_pattern": "Apply a declared conversion matrix/quaternion or reject mixed conventions fail closed.",
      "required_regression": "Cover handedness, up-axis, forward-axis, finite transforms, and round-trip tolerance.",
      "trigger": "Parent and child frames change handedness or axes without an explicit conversion."
    },
    {
      "confidence": 0.99,
      "defect_class": "nested_unit_double_application",
      "detector_id": "detect_nested_unit_double_application",
      "false_positive_guard": "Geometric scale remains allowed when separately represented from unit conversion.",
      "generalization_scope": [
        "coordinate composition",
        "asset import",
        "scene transforms"
      ],
      "invariant": "Units are applied exactly once and remain conceptually distinct from geometric scale.",